{"$schema":"https://json-schema.org/draft/2020-12/schema","$id":"https://github.com/matrakalaka/codex-project-bootstrap/contracts/task_packet.v0.schema.json","title":"Task Packet v0","type":"object","additionalProperties":false,"required":["schema_version","correlation_id","task_id","origin","target","objective","scope","authority_requirements","mutation_allowed","required_verification","required_capabilities","known_good_references","approval_state","retry","stop_condition"],"properties":{"schema_version":{"const":"task_packet.v0"},"correlation_id":{"type":"string","minLength":1},"task_id":{"type":"string","minLength":1},"origin":{"type":"object","additionalProperties":false,"required":["kind","label"],"properties":{"kind":{"type":"string","enum":["CHATGPT","HUMAN","LOOP"]},"label":{"type":"string","minLength":1}}},"target":{"type":"object","additionalProperties":false,"required":["repository_locator"],"properties":{"repository_locator":{"type":"string","minLength":1},"expected_repository_identity":{"type":["string","null"]},"expected_head":{"type":["string","null"],"pattern":"^[0-9a-fA-F]{40}$"}}},"objective":{"type":"string","minLength":1},"scope":{"type":"object","additionalProperties":false,"required":["allowed_paths","forbidden_paths"],"properties":{"allowed_paths":{"type":"array","items":{"type":"string","minLength":1}},"forbidden_paths":{"type":"array","items":{"type":"string","minLength":1}}}},"authority_requirements":{"type":"object","additionalProperties":false,"required":["required_sources","authority_change_allowed_paths"],"properties":{"required_sources":{"type":"array","items":{"type":"string"}},"authority_change_allowed_paths":{"type":"array","items":{"type":"string"}}}},"mutation_allowed":{"type":"boolean"},"required_verification":{"type":"array","items":{"type":"object","additionalProperties":false,"required":["id","description"],"properties":{"id":{"type":"string","minLength":1},"description":{"type":"string","minLength":1},"evidence_requirement":{"type":"string"}}}},"required_capabilities":{"type":"array","items":{"type":"string"}},"known_good_references":{"type":"array","items":{"type":"string"}},"approval_state":{"type":"string","enum":["PENDING","APPROVED","REJECTED"]},"retry":{"type":"object","additionalProperties":false,"required":["idempotency_key","attempt","retry_policy"],"properties":{"idempotency_key":{"type":"string","minLength":1},"attempt":{"type":"integer","minimum":0},"retry_policy":{"type":"string","minLength":1}}},"stop_condition":{"type":"string","minLength":1},"playbook":{"type":"object","additionalProperties":false,"required":["id","version","fingerprint","parameters"],"properties":{"id":{"type":"string","minLength":1},"version":{"type":"string","minLength":1},"fingerprint":{"type":"string","pattern":"^sha256:[0-9a-f]{64}$"},"parameters":{"type":"object"}}}}}
