{"schema_version":"task_packet.v0","correlation_id":"corr-1","task_id":"task-1","origin":{"kind":"HUMAN","label":"fixture"},"target":{"repository_locator":"repo"},"objective":"Apply bounded UI fix","scope":{"allowed_paths":["src/**"],"forbidden_paths":["secrets/**"]},"authority_requirements":{"required_sources":["AGENTS.md"],"authority_change_allowed_paths":[]},"mutation_allowed":true,"required_verification":[{"id":"tests","description":"run tests"}],"required_capabilities":[],"known_good_references":[],"approval_state":"PENDING","retry":{"idempotency_key":"idem-1","attempt":0,"retry_policy":"NO_AUTOMATIC_MUTATION_RETRY"},"stop_condition":"ONE_VERIFIED_CHECKPOINT","playbook":{"id":"ui_visual_fix","version":"2","fingerprint":"sha256:aaaaaaaaaaaaaaaaaaaaaaaaaaaaaaaaaaaaaaaaaaaaaaaaaaaaaaaaaaaaaaaa","parameters":{}}}
